<!DOCTYPE flight_plan SYSTEM "flight_plan.dtd">

<flight_plan alt="75" ground_alt="0" lat0="43.4622" lon0="1.2729" max_dist_from_home="1500" name="Basic" qfu="270" security_height="25">
  <header>
#include "nav_line.h"
#include "datalink.h"
</header>
  <waypoints>
    <waypoint name="HOME" x="0" y="0"/>
    <waypoint name="STDBY" x="20" y="80"/>
    <waypoint name="1" x="44.8" y="102.2"/>
    <waypoint name="2" x="-63.5" y="122.9"/>
    <waypoint name="MOB" x="-11.5" y="-21.2"/>
    <waypoint name="S1" x="-151.6" y="80.4"/>
    <waypoint name="S2" x="180.1" y="214.9"/>
    <waypoint alt="30" name="AF" x="200" y="-10"/>
    <waypoint name="TOD" x="8.0" y="-22.7"/>
    <waypoint alt="0" name="TD" x="80.0" y="20.0"/>
    <waypoint name="BASELEG" x="26.9" y="-23.0"/>
    <waypoint name="CLIMB" x="-122.5" y="35.4"/>
  </waypoints>
  <exceptions>
    <exception cond="datalink_time > 22" deroute="Standby"/>
  </exceptions>
  <blocks>
    <block name="Wait GPS">
      <set value="1" var="kill_throttle"/>
      <while cond="!GpsFixValid()"/>
    </block>
    <block name="Geo init">
      <while cond="LessThan(NavBlockTime(), 10)"/>
      <call fun="NavSetGroundReferenceHere()"/>
    </block>
    <block name="Holding point">
      <set value="1" var="kill_throttle"/>
      <attitude roll="0" throttle="0" vmode="throttle"/>
    </block>
    <block name="Takeoff" strip_icon="takeoff.png" strip_button="Takeoff (wp CLIMB)">
      <exception cond="estimator_z > ground_alt+25" deroute="Standby"/>
      <set value="0" var="kill_throttle"/>
      <set value="0" var="estimator_flight_time"/>
      <go wp="CLIMB"/>
    </block>
    <block name="Standby" strip_button="Standby" strip_icon="home.png">
      <circle radius="nav_radius" wp="STDBY"/>
    </block>
    <block name="Figure 8 around wp 1" strip_button="Figure 8 (wp 1-2)" strip_icon="eight.png">
      <eight center="1" radius="nav_radius" turn_around="2"/>
    </block>
    <block name="Oval 1-2" strip_button="Oval (wp 1-2)" strip_icon="oval.png">
      <oval p1="1" p2="2" radius="nav_radius"/>
    </block>
    <block name="MOB" strip_button="Turn around here" strip_icon="mob.png">
      <call fun="NavSetWaypointHere(WP_MOB)"/>
      <set value="DEFAULT_CIRCLE_RADIUS" var="nav_radius"/>
      <circle radius="nav_radius" wp="MOB"/>
    </block>
    <block name="Line 1-2" strip_button="Line (wp 1-2)" strip_icon="line.png">
      <call fun="nav_line_init()"/>
      <call fun="nav_line(WP_1, WP_2, nav_radius)"/>
    </block>
    <block name="Survey S1-S2" strip_button="Survey (wp S1-S2)" strip_icon="survey.png">
      <survey_rectangle grid="150" wp1="S1" wp2="S2"/>
    </block>
    <block name="Land Right AF-TD" strip_button="Land right (wp AF-TD)" strip_icon="land-right.png">
      <set value="DEFAULT_CIRCLE_RADIUS" var="nav_radius"/>
      <deroute block="land"/>
    </block>
    <block name="Land Left AF-TD" strip_button="Land left (wp AF-TD)" strip_icon="land-left.png">
      <set value="-DEFAULT_CIRCLE_RADIUS" var="nav_radius"/>
      <deroute block="land"/>
    </block>
    <block name="land">
      <call fun="nav_compute_baseleg(WP_AF, WP_TD, WP_BASELEG, nav_radius)"/>
      <circle radius="nav_radius" until="NavCircleCount() > 0.5" wp="BASELEG"/>
      <set value="V_CTL_AUTO_THROTTLE_MIN_CRUISE_THROTTLE" var="v_ctl_auto_throttle_cruise_throttle"/>
      <circle radius="nav_radius" until="NavQdrCloseTo(DegOfRad(baseleg_out_qdr)-10) && 10 > fabs(estimator_z - WaypointAlt(WP_BASELEG))" wp="BASELEG"/>
    </block>
    <block name="final">
      <exception cond="ground_alt + 10 > estimator_z" deroute="flare"/>
      <go from="AF" hmode="route" vmode="glide" wp="TD"/>
    </block>
    <block name="flare">
      <go approaching_time="0" from="TOD" hmode="route" throttle="0.0" vmode="throttle" wp="TD"/>
      <attitude roll="0.0" throttle="0.0" until="FALSE" vmode="throttle"/>
    </block>
  </blocks>
</flight_plan>
