<!DOCTYPE flight_plan SYSTEM "flight_plan.dtd">

<flight_plan ground_alt="200" alt="250" lat0="43.4624" lon0="1.2727" max_dist_from_home="1500" name="Intelligent Surveillance" qfu="270" security_height="25">
<header>
#include "anemotaxis.h"
#include "chemotaxis.h"
#include "discsurvey.h"
</header>
  <waypoints>
    <waypoint name="HOME" x="0" y="0"/>
    <waypoint name="1" x="200" y="0"/>
    <waypoint name="2" x="0" y="200"/>
    <waypoint name="MOB" x="200" y="200"/>
    <waypoint name="S1" x="-200" y="-200"/>
    <waypoint name="S2" x="300" y="400"/>
    <waypoint name="C" x="-250" y="-200"/>
    <waypoint name="C1" x="-200" y="-200"/>
    <waypoint name="C2" x="300" y="400"/>
    <waypoint name="PLUME" x="400" y="400"/>
  </waypoints>
  <blocks>
<!--
    <block name="wait GPS">
      <while cond="!GpsFixValid()"/>
    </block>

    <block name="init">
      <while cond="LessThan(NavBlockTime(), 10)"/>
      <call fun="NavSetGroundReferenceHere()"/>
      <deroute block="circle 1"/>
    </block>
-->

    <block name="circle 1">
      <circle radius="75" wp="1"/>
    </block>

    <block name="eight 1">
      <eight radius="75" center="1" turn_around="2"/>
    </block>

    <block name="oval" strip_button="Oval">
      <oval p1="1" p2="2" radius="80"/>
    </block>

    <block name="MOB" strip_button="MOB">
      <call fun="NavSetWaypointHere(WP_MOB)"/>
      <circle wp="MOB" radius="100"/>
    </block>

    <block name="Anemotaxis" strip_button="Anemotaxis">
      <call fun="nav_anemotaxis_downwind(WP_C)"/>
      <go wp="C" hmode="route" approaching_time="0"/>
      <call fun="nav_anemotaxis_init(WP_C)"/>
      <call fun="nav_anemotaxis(WP_C, WP_C1, WP_C2, WP_PLUME)"/>
    </block>

    <block name="Chemotaxis" strip_button="Chemotaxis">
      <call fun="nav_chemotaxis_init()"/>
      <call fun="nav_chemotaxis(WP_C, WP_PLUME)"/>
    </block>

    <block name="Disc survey" strip_button="DS">
      <call fun="disc_survey_init()"/>
      <call fun="disc_survey(WP_HOME, 500)"/>
    </block>

    <block name="circle 1 auto pitch">
      <circle radius="75" wp="1" pitch="auto" throttle="0.7"/>
    </block>

    <block name="circle left 1">
      <circle radius="-75" wp="1"/>
    </block>

    <block name="climb 75">
      <circle radius="50+(estimator_z-ground_alt)/2" wp="1" throttle="0.75" pitch="0.3" vmode="throttle" until="10 > PowerVoltage()"/>
    </block>

    <block name="climb 1">
      <circle radius="50+(estimator_z-ground_alt)/2" wp="1" climb="1" pitch="0.1" vmode="climb" until="10 > PowerVoltage()"/>
    </block>

    <block name="descent 0" strip_button="Descent">
      <circle radius="50+(estimator_z-ground_alt)/2" wp="1" throttle="0.0" pitch="-0.3" vmode="throttle" until="ground_alt+50 > estimator_z"/>
      <deroute block="circle 1"/>
    </block>

    <block name="route12">
      <go approaching_time="0" from="1" hmode="route" wp="2"/>
    </block>

    <block name="glide12">
      <go from="1" hmode="route" vmode="glide" wp="2"/>
    </block>

    <block name="stack 2">
      <circle radius="75" wp="2"/>
    </block>

    <block name="route21">
      <go approaching_time="0" from="2" hmode="route" wp="1"/>
    </block>

    <block name="stack 1">
      <circle radius="75" wp="1"/>
    </block>

    <block name="survey">
      <survey_rectangle grid="150" wp1="S1" wp2="S2"/>
    </block>

    <block name="follow">
      <follow ac_id="5" distance="25" height="10"/>
    </block>
  </blocks>
</flight_plan>
